{
  "schema_version": "nlo-experiment-event-v1",
  "experiment_event_id": "exp-fixture-oom-001",
  "run_record_id": "run-fixture-oom-001",
  "failure_observation_ids": [
    "failure-fixture-oom-001"
  ],
  "hardware_profile_id": "hw-fixture-constrained-001",
  "observed_at": "2026-03-13T22:00:00Z"
}
